url,currency,price,price_unit_scale,title,address,facilities,k. tidur,k. mandi,l. tanah,l. bangunan,carport,tipe properti,sertifikat,daya listrik,kt. pembantu,km. pembantu,garasi,jumlah lantai,kondisi properti,kondisi perabotan,hadap,id iklan,tahun dibangun,bedrooms,bathrooms,land size,building size,carports,certificate,maid bedrooms,maid bathrooms,garages,floors,property condition,furnishing,building orientation,electricity,building age
https://www.rumah123.com/properti/jakarta-barat/hos10612659/#qid~8ba85171-8d56-4e8d-8bef-d93d19712d06,Rp,"2,34",Miliar,Rumah Bebas Banjir Dekat Cengkareng di Kembangan Baru Harga All In Kpr,"Kembangan Selatan, Jakarta Barat","Taman, Keamanan",,,,,,rumah,,,,,,,,,,hos10612659,,3,2,97 m²,120 m²,,shm - sertifikat hak milik,,,1,2,,unfurnished,,2200 mah,
https://www.rumah123.com/properti/jakarta-selatan/hos8958785/#qid~8ba85171-8d56-4e8d-8bef-d93d19712d06,Rp,"3,65",Miliar,Perumahan Mewah Di Cilandak Jaksel Lokasi Pinggir Jalan Raya,"Cilandak, Jakarta Selatan","Taman,  Masjid, Jalur Telepon,  Keamanan",3,2,104 m²,126 m²,1,rumah,shm - sertifikat hak milik,2200 mah,1,1,1,2,baru,unfurnished,utara,hos8958785,2021,,,,,,,,,,,,,,,
https://www.rumah123.com/properti/jakarta-selatan/hos11190875/#qid~8ba85171-8d56-4e8d-8bef-d93d19712d06,Rp,14,Miliar,Rumah Mewah Murah harga di bawah NJOP Dekat Tol TB Simatupang,"Kebagusan, Jakarta Selatan"," Kolam Renang,  Taman, Jalur Telepon, Ac, Kolam Renang, AC,  Keamanan",6,5,1431 m²,500 m²,4,rumah,shm - sertifikat hak milik,16500 mah,,,2,2,bagus,semi furnished,barat,hos11190875,2015,,,,,,,,,,,,,,,
https://www.rumah123.com/properti/jakarta-selatan/hos10503306/#qid~8ba85171-8d56-4e8d-8bef-d93d19712d06,Rp,"2,64",Miliar,Rumah Minimalis Modern di Pomentia Residence Jagakarsa Harga All In Kpr,"Jagakarsa, Jakarta Selatan","Taman, Keamanan",4,4,110 m²,140 m²,1,rumah,shm - sertifikat hak milik,2200 mah,1,,1,2,bagus,unfurnished,,hos10503306,,,,,,,,,,,,,,,,
https://www.rumah123.com/properti/jakarta-utara/hos10983860/#qid~8ba85171-8d56-4e8d-8bef-d93d19712d06,Rp,"6,75",Miliar,Rumah Pik2 10X18 - Dekat Danau & Playground,"Pantai Indah Kapuk, Jakarta Utara"," Kolam Renang, Keamanan 24 jam, Taman, Jogging Track,  Keamanan, Track Lari",4,4,180 m²,224 m²,2,rumah,,4400 mah,1,1,,2,baru,unfurnished,selatan,hos10983860,2021,,,,,,,,,,,,,,,
https://www.rumah123.com/properti/jakarta-utara/hos10905837/#qid~8ba85171-8d56-4e8d-8bef-d93d19712d06,Rp,"13,5",Miliar,Rumah Minimalis Katamaran PIK (9x25m),"Pantai Indah Kapuk, Jakarta Utara","Taman, Keamanan",6,4,225 m²,300 m²,1,rumah,shm - sertifikat hak milik,4400 mah,1,1,1,3,baru,unfurnished,timur,hos10905837,2018,,,,,,,,,,,,,,,
https://www.rumah123.com/properti/jakarta-barat/hos11187300/#qid~8ba85171-8d56-4e8d-8bef-d93d19712d06,Rp,"1,8",Miliar,Andre Tjhia Tanjung Duren Rumah Lokasi Premium Lebar Jalan 3 Mobil,"Tanjung Duren, Jakarta Barat","Taman, Track Lari, Tempat Jemuran, Keamanan 24 jam",2,2,56 m²,105 m²,1,rumah,shm - sertifikat hak milik,2200 mah,1,,,2,bagus,,selatan,hos11187300,,,,,,,,,,,,,,,,
https://www.rumah123.com/properti/jakarta-barat/hos11187341/#qid~8ba85171-8d56-4e8d-8bef-d93d19712d06,Rp,"1,1",Miliar,Andre Tjhia Duri Kepa Rumah Ukuran 6x13 Jalan 1 Mobil Lega Harga Pas,"Duri Kepa, Jakarta Barat","Keamanan 24 jam, Tempat Jemuran, Akses Parkir",2,1,78 m²,100 m²,2,rumah,shm - sertifikat hak milik,2200 mah,,,,1,bagus,,selatan,hos11187341,,,,,,,,,,,,,,,,
https://www.rumah123.com/properti/jakarta-barat/hos11187046/#qid~8ba85171-8d56-4e8d-8bef-d93d19712d06,Rp,"4,9",Miliar,"Rumah Permata Buana Luas tanah 144 m2, Full renovasi! Siap huni!","Permata Buana, Jakarta Barat"," Taman, Jalur Telepon, Kitchen Set, Keamanan,  AC, Wastafel,  Ac, Track Lari, Tempat Jemuran,  Jogging Track, Lapangan Tenis",3,2,144 m²,250 m²,,rumah,shm - sertifikat hak milik,5500 mah,1,1,2,2,sudah renovasi,semi furnished,utara,hos11187046,2014,,,,,,,,,,,,,,,
https://www.rumah123.com/properti/jakarta-barat/hos11185930/#qid~8ba85171-8d56-4e8d-8bef-d93d19712d06,Rp,"2,3",Miliar,Andre Tjhia Meruya Luxurious House High Celling Fasad Sangat Istimewa,"Meruya, Jakarta Barat",Keamanan 24 jam,3,3,125 m²,150 m²,3,rumah,shm - sertifikat hak milik,2200 mah,1,1,,2,baru,,,hos11185930,2022,,,,,,,,,,,,,,,
https://www.rumah123.com/properti/jakarta-barat/hos11185975/#qid~8ba85171-8d56-4e8d-8bef-d93d19712d06,Rp,"2,3",Miliar,Andre Tjhia Meruya Luxurious House High Celling Fasad Sangat Istimewa,"Meruya, Jakarta Barat","Taman, Track Lari, Tempat Jemuran, Keamanan 24 jam",3,3,125 m²,150 m²,3,rumah,shm - sertifikat hak milik,2200 mah,1,1,,2,baru,,,hos11185975,2022,,,,,,,,,,,,,,,
https://www.rumah123.com/properti/jakarta-barat/hos11185956/#qid~8ba85171-8d56-4e8d-8bef-d93d19712d06,Rp,"1,55",Miliar,Andre Tjhia Meruya Luxurious House High Celling Fasad Sangat Istimewa,"Meruya, Jakarta Barat",Keamanan 24 jam,3,3,60 m²,85 m²,3,rumah,shm - sertifikat hak milik,2200 mah,,,,2,baru,,,hos11185956,2022,,,,,,,,,,,,,,,
https://www.rumah123.com/properti/jakarta-barat/hos11186006/#qid~8ba85171-8d56-4e8d-8bef-d93d19712d06,Rp,"1,85",Miliar,Andre Tjhia Meruya 5x16 Luxurious House High Celling Fasad Sangat Istimewa,"Meruya, Jakarta Barat","Taman, Tempat Jemuran, Keamanan, Keamanan 24 jam",3,3,80 m²,120 m²,3,rumah,shm - sertifikat hak milik,2200 mah,,,,2,baru,,,hos11186006,2022,,,,,,,,,,,,,,,
https://www.rumah123.com/properti/jakarta-barat/hos11186069/#qid~8ba85171-8d56-4e8d-8bef-d93d19712d06,Rp,"2,15",Miliar,Andre Tjhia Meruya Luxurious House Sangat Istimewa Lokasi Premium Nego,"Meruya, Jakarta Barat","Taman, Tempat Jemuran, Keamanan, Keamanan 24 jam",3,3,125 m²,150 m²,3,rumah,shm - sertifikat hak milik,2200 mah,1,1,,2,baru,,,hos11186069,2022,,,,,,,,,,,,,,,
